{
    "pins": [
        "PB2",
        "PB3"
    ],
    "beginTime": "10ns",
    "type": "UART",
    "Interface Configuration": {
        "Pin Configuration": {
            "PB2": "TX",
            "PB3": "RX"
        },
        "Baud Rate": 9600,
        "Data Bits": 8,
        "Parity Bit": 0,
        "Stop Bits": 1
    },
    "Data": {
        "PinStates": { },
        "TX": [ 104, 101, 108, 108, 111, 44, 32, 119, 111, 114, 108, 100 ],
        "RX": [ ]
    }
}